{
  "slug": "agent-readability-service",
  "name": "Agent Readability Service",
  "url": "https://kc-it.pl/services/agent-readability",
  "description": "Done-for-you agent readability: llms.txt, schema.org JSON-LD, robots.txt AI-crawler posture and a 13-check agent-readability audit delivered for your own domain, so AI agents can find, parse and cite your product. Case study: 12 sites, average score 68.6 to 97.5. Open a [hire] issue on the repo or email 110kc3@gmail.com.",
  "category": "other",
  "pricing": "paid",
  "tags": ["geo", "llms-txt", "json-ld", "audit"],
  "submitted_by": "registry (seed)",
  "created": "2026-07-09",
  "github_user": "110kc3",
  "tier": "free",
  "updated": "2026-07-29"
}
