{
  "slug": "hlido-agent-reviews",
  "name": "Hlido Agent Reviews",
  "url": "https://hlido.eu",
  "description": "Independent AI-agent reviews: trust checks, evidence scorecards, incident registry, recommendations.",
  "category": "mcp",
  "pricing": "free",
  "machine_endpoints": {
    "mcp": "https://hlido.eu/mcp"
  },
  "tags": [
    "mcp",
    "remote"
  ],
  "submitted_by": "registry (curated)",
  "created": "2026-08-01",
  "github_user": "110kc3",
  "tier": "free"
}
